Table,Description,Fields,Example_Questions,Usage_Tips,Multi_Table_Questions,Related_Tables,Join_Conditions
club,"记录俱乐部的固定基础信息","Club_ID, Club_name, Region, Start_year","建于比特币网络第一次发布那年之前的俱乐部占俱乐部总数的百分之多少？|如果Helsingborgs IF俱乐部建立于2000年，建于比特币网络第一次发布那年之前的俱乐部占俱乐部总数的百分之多少？|有百分之多少的俱乐部成立于21世纪之前？","该表信息不会随时间变化，用于查询俱乐部的基本属性或历史信息，当问题涉及俱乐部的地理位置、成立时间等基础信息或需要计算与俱乐部相关的比例时，选用此表","建于比特币网络第一次发布那年之前的俱乐部占俱乐部总数的百分之多少？|如果Helsingborgs IF俱乐部建立于2000年，建于比特币网络第一次发布那年之前的俱乐部占俱乐部总数的百分之多少？|有百分之多少的俱乐部成立于21世纪之前？","coach,match_result","club.Club_ID = coach.Club_ID; club.Club_ID = match_result.Club_ID"
coach,"记录教练的固定信息","Coach_ID, Coach_name, Gender, Club_ID, Rank","詹姆森托马斯指导的选手取得冠军的概率有多大？|哪个教练培养的冠军最多，他的名字是什么，比培养的冠军最少的教练培养的冠军数量多多少？|教练每培养一个冠军可以获得100美元奖金，每培养一个亚军可以获得60美元奖金，每培养一个季军可以获得20美元奖金。哪个教练获得的奖金最多，他的名字是什么，他的奖金是多少？","当问题涉及教练的属性、与选手的指导关系或教练的成就统计时，选用此表","詹姆森托马斯指导的选手取得冠军的概率有多大？|哪个教练培养的冠军最多，他的名字是什么，比培养的冠军最少的教练培养的冠军数量多多少？|教练每培养一个冠军可以获得100美元奖金，每培养一个亚军可以获得60美元奖金，每培养一个季军可以获得20美元奖金。哪个教练获得的奖金最多，他的名字是什么，他的奖金是多少？","club,player_coach","coach.Club_ID = club.Club_ID; coach.Coach_ID = player_coach.Coach_ID"
match_result,"记录俱乐部的比赛结果信息","Rank, Club_ID, Gold, Big_Silver, Small_Silver, Bronze, Points","排名第一的俱乐部拥有的奖牌总数是第三名的多少倍？|拥有世界最长铁路的国家的所有俱乐部获得的奖牌一共有多少？|如果一枚金牌可以获得5个积分，一枚大银牌获得3分，一枚小银牌获得2分，一枚铜牌获得1分，获得最多积分的俱乐部位于哪里，成立于哪年，有几个男教练，女教练？","当问题涉及俱乐部的比赛成绩、奖牌数量或积分计算时，选用此表","排名第一的俱乐部拥有的奖牌总数是第三名的多少倍？|拥有世界最长铁路的国家的所有俱乐部获得的奖牌一共有多少？|如果一枚金牌可以获得5个积分，一枚大银牌获得3分，一枚小银牌获得2分，一枚铜牌获得1分，获得最多积分的俱乐部位于哪里，成立于哪年，有几个男教练，女教练？","club","match_result.Club_ID = club.Club_ID"
player,"记录选手的固定信息","Player_ID, Sponsor_name, Player_name, Gender, Residence, Occupation, Votes, Rank","获得过冠军的选手中，小商人的占比是多少？|哪位居住在加拿大马尼托巴省首府的球员获得的选票是罗斯马丁的两倍多？给出他们的名字|哪些球员由21世纪之前成立的俱乐部的教练指导，他们的名字是什么？他们的选票比最低选票的高多少？","当问题涉及选手的个人信息、选票统计或排名分析时，选用此表","获得过冠军的选手中，小商人的占比是多少？|哪位居住在加拿大马尼托巴省首府的球员获得的选票是罗斯马丁的两倍多？给出他们的名字|哪些球员由21世纪之前成立的俱乐部的教练指导，他们的名字是什么？他们的选票比最低选票的高多少？","player_coach","player.Player_ID = player_coach.Player_ID"
player_coach,"记录选手与教练之间的指导关系","Player_ID, Coach_ID, Starting_year","有教练的选手占选手总数的百分之多少？|没有教练的选手获得冠军的概率是多少？|有教练的选手获得前两名的概率比没有教练的选手获得前两名的概率大多少？","当问题涉及选手与教练的指导关系、指导时间或与指导相关的概率统计时，选用此表","有教练的选手占选手总数的百分之多少？|没有教练的选手获得冠军的概率是多少？|有教练的选手获得前两名的概率比没有教练的选手获得前两名的概率大多少？","player,coach","player_coach.Player_ID = player.Player_ID; player_coach.Coach_ID = coach.Coach_ID"